{
  "$schema": "https://json-schema.org/draft/2020-12/schema",
  "$id": "urn:pointr:contracts:0.20.0:calibration",
  "title": "camera calibration",
  "type": "object",
  "additionalProperties": false,
  "required": [
    "contract_version", "calibration_id", "camera_id", "created_at", "court", "image_size",
    "homography_image_to_court", "points", "errors", "max_check_error_m", "forced", "audit_frame"
  ],
  "properties": {
    "contract_version": {"const": "0.20.0"},
    "calibration_id": {"$ref": "#/$defs/uuid4"},
    "camera_id": {"type": "string", "pattern": "^[A-Za-z0-9_-]{1,32}$"},
    "created_at": {"$ref": "#/$defs/utc"},
    "court": {
      "type": "object",
      "additionalProperties": false,
      "required": ["kind", "type", "length_m", "width_m", "landmarks"],
      "properties": {
        "kind": {"enum": ["fiba_full", "fiba_half", "custom"]},
        "type": {"enum": ["fiba_full", "fiba_half", "custom"]},
        "length_m": {"type": "number", "exclusiveMinimum": 0},
        "width_m": {"type": "number", "exclusiveMinimum": 0},
        "landmarks": {"type": "object", "additionalProperties": {"$ref": "#/$defs/point"}}
      },
      "allOf": [
        {
          "if": {"properties": {"type": {"const": "fiba_full"}}},
          "then": {"properties": {"length_m": {"const": 28}, "width_m": {"const": 15}}}
        },
        {
          "if": {"properties": {"type": {"const": "fiba_half"}}},
          "then": {"properties": {"length_m": {"const": 14}, "width_m": {"const": 15}}}
        }
      ]
    },
    "image_size": {
      "type": "object",
      "additionalProperties": false,
      "required": ["width", "height"],
      "properties": {
        "width": {"type": "integer", "minimum": 1},
        "height": {"type": "integer", "minimum": 1}
      }
    },
    "homography_image_to_court": {"$ref": "#/$defs/matrix3"},
    "points": {
      "type": "array",
      "minItems": 6,
      "items": {
        "type": "object",
        "additionalProperties": false,
        "required": ["image_px", "court_m", "role", "residual_m"],
        "properties": {
          "image_px": {"$ref": "#/$defs/point"},
          "court_m": {"$ref": "#/$defs/point"},
          "role": {"enum": ["calibration", "check"]},
          "residual_m": {"type": "number", "minimum": 0}
        }
      },
      "allOf": [
        {"contains": {"properties": {"role": {"const": "calibration"}}}, "minContains": 4},
        {"contains": {"properties": {"role": {"const": "check"}}}, "minContains": 2}
      ]
    },
    "errors": {
      "type": "object",
      "additionalProperties": false,
      "required": ["calibration_mean_m", "check_mean_m", "check_max_m"],
      "properties": {
        "calibration_mean_m": {"type": "number", "minimum": 0},
        "check_mean_m": {"type": "number", "minimum": 0},
        "check_max_m": {"type": "number", "minimum": 0}
      }
    },
    "max_check_error_m": {"type": "number", "exclusiveMinimum": 0, "maximum": 2.0},
    "forced": {"type": "boolean"},
    "audit_frame": {"const": "frame.jpg"}
  },
  "$defs": {
    "point": {
      "type": "array",
      "items": {"type": "number"},
      "minItems": 2,
      "maxItems": 2
    },
    "matrix3": {
      "type": "array",
      "items": {"type": "array", "items": {"type": "number"}, "minItems": 3, "maxItems": 3},
      "minItems": 3,
      "maxItems": 3
    },
    "uuid4": {
      "type": "string",
      "pattern": "^[0-9a-f]{8}-[0-9a-f]{4}-4[0-9a-f]{3}-[89ab][0-9a-f]{3}-[0-9a-f]{12}$"
    },
    "utc": {
      "type": "string",
      "pattern": "^\\d{4}-\\d{2}-\\d{2}T\\d{2}:\\d{2}:\\d{2}(\\.\\d+)?Z$"
    }
  }
}
