{
  "contract_version": "0.20.0",
  "calibration_id": "3f1c2a8e-5b7d-4e9a-8c21-6d4f0b9e7a13",
  "camera_id": "cam1",
  "created_at": "2026-10-13T18:00:00Z",
  "court": {
    "kind": "custom",
    "type": "custom",
    "length_m": 3.0,
    "width_m": 2.0,
    "landmarks": {"near_left": [0.0, 0.0], "far_right": [3.0, 2.0]}
  },
  "image_size": {"width": 640, "height": 480},
  "homography_image_to_court": [[0.01, 0.0, 0.0], [0.0, 0.01, 0.0], [0.0, 0.0, 1.0]],
  "points": [
    {"image_px": [0, 0], "court_m": [0, 0], "role": "calibration", "residual_m": 0.0},
    {"image_px": [300, 0], "court_m": [3, 0], "role": "calibration", "residual_m": 0.0},
    {"image_px": [300, 200], "court_m": [3, 2], "role": "calibration", "residual_m": 0.0},
    {"image_px": [0, 200], "court_m": [0, 2], "role": "calibration", "residual_m": 0.0},
    {"image_px": [150, 100], "court_m": [1.5, 1], "role": "check", "residual_m": 0.0},
    {"image_px": [75, 150], "court_m": [0.75, 1.5], "role": "check", "residual_m": 0.0}
  ],
  "errors": {"calibration_mean_m": 0.0, "check_mean_m": 0.0, "check_max_m": 0.0},
  "max_check_error_m": 0.5,
  "forced": false,
  "audit_frame": "frame.jpg"
}
